Header,Section
"Paul Tudor Jones says the U.S. economy is on an ‘unsustainable’ path, threatening markets",Investing
Steve Eisman doesn’t see a systemic problem from commercial real estate,Investing
"Here are Monday’s biggest analyst calls: Nvidia, Apple, Mattel, Amazon, Tesla, Charter and more",Investing
Goldman now sees Nvidia rising to $800 in 12 months,Investing
Comeback stocks: These names have jumped to start 2024 after falling last year,Investing
"Monday’s analyst calls: ‘Barbie’ toy stock gets a downgrade, Goldman hikes Nvidia price target",Investing
Top Wall Street analysts suggest these 3 stocks for solid upside,Investing
"Earnings playbook: Your guide to another big week of reports, including Disney and Ford",Investing
"Stablecoin expansion is bringing liquidity to crypto, but JPMorgan warns of challenges ahead",Investing
"While Chinese stocks search for a bottom, analysts say these shares are poised to bounce",Investing
Why parts of the ‘Magnificent 7’ are losing their luster,Investing
"Buy these top tech stocks before it’s too late, Morgan Stanley says",Investing
Activist Bluebell believes BP is 50% undervalued compared to peers,Investing
Self-navigating ships could change the shipping industry. Here are the companies poised to benefit,Investing
"Investors are unlikely to dump cash in favor of locking in bond yields, JPMorgan says",Investing
Tesla is one of the most oversold stocks in the S&P 500 and could be due for a bounce,Investing
"For investors who scored big on Meta, a way to protect those profits and generate income",Investing
"Forget ‘FANG’ and ‘Magnificent 7,’ the new hot portfolio is ‘MnM,’ says Raymond James",Investing
"Here are Friday’s biggest analyst calls: Nvidia, Apple, Meta, Amazon, Disney, Nike, Costco & more",Investing
These companies have earnings momentum heading into their reports next week,Investing
"Friday’s analyst calls: What the Street says after more Big Tech earnings, Nvidia price target hike",Investing
Morgan Stanley names Ford its new top pick among U.S. automakers,Investing
These companies reporting next week have a history of beating earnings expectations,Investing
Tax season is underway. Here’s what investors should know to prepare,Investing
"Bitcoin could stay rangebound for weeks, but Solana is poised for a breakout, says Wolfe Research",Investing
"Apple is losing momentum ahead of earnings, reducing chances of a breakout, according to the charts",Investing
Goldman gives this innovative cancer-fighting biotech nearly 70% upside,Investing
Morgan Stanley sees opportunities for these ‘underappreciated’ stocks as AI drives power demand,Investing
"Buy these small-cap stocks with solid growth and attractive valuations, Goldman Sachs says",Investing
A simple options trade on a steady health care stock benefitting from an aging population,Investing
BofA says NY Community Bancorp plunge isn’t indicative ‘of wider problem’,Investing
"Here are Thursday’s biggest analyst calls: Nvidia, Apple, Microsoft, Qualcomm, Target, AT&T, Tesla",Investing
These are the best-performing stocks since the market low in October. Where analysts see them going,Investing
"Thursday’s analyst calls: Tesla sell rating conviction, Qualcomm gets a downgrade",Investing
Ether takes center stage as bitcoin heads into one of its strongest months,Investing
The 10-year Treasury yield sits at a critical juncture. What the charts say will happen next,Investing
Here’s the magnitude of AI’s effect on Microsoft’s bottom line and what it means for the stock,Investing
Walmart just split its stock. History shows what will happen next with the megacap,Investing
"50 years of history tell you to buy gold when the Fed cuts rates, says Bernstein",Investing
"As tech stocks slide, there’s another giant that looks overextended. How to profit from the pullback",Investing
"Megacap dominance today is more similar to the dot-com bubble than investors realize, warns JPMorgan",Investing
These Apple suppliers have the most to win or lose from the tech giant’s upcoming earnings,Investing
Walmart’s stock split only shows how rare it has become in the past 20 years,Investing
"Here are Wednesday’s biggest analyst calls: Apple, Tesla, Alphabet, Microsoft, AMD, Meta, Spotify",Investing
"Wednesday’s analyst calls: Microsoft and Alphabet get price target increases, SoFi downgraded",Investing
Traders who scored big and grew famous for ‘The Big Short’ reveal their current bets,Investing
"Launch of new ETFs may not affect bitcoin the same way they did gold, Citi says. Here’s why",Investing
We could have a new member of the $2 trillion market cap club this week,Investing
Annuity sales hit a record in 2023. Here’s what to know about one popular option,Investing
"Amazon shares are running into stiff resistance ahead of earnings, according to the charts",Investing
"This little-known oncology stock could jump more than 70%, Citi says",Investing
Oppenheimer says bank stocks are ‘significantly undervalued’ and gives its top picks,Investing
A low-cost hedge if Big Tech earnings disappoint and the Nasdaq rally fizzles,Investing
"These smaller stocks could see big gains in 2024, Bank of America says",Investing
"Here are Tuesday’s biggest analyst calls: Amazon, Tesla, Goldman Sachs, Meta, Salesforce, Boeing",Investing
Here are five stocks to buy as the market keeps rallying to record highs,Investing
"Tuesday’s analyst calls: Big banks get major upgrades, UBS calls for 25% rally in Spotify",Investing
How ‘quiet luxury’ is subtly taking over investor portfolios,Investing
"Busy Fed week, tech earnings could dictate the course of this rally, Fundstrat’s Tom Lee says",Investing
Gerstner: Meta is better positioned than the rest of the ‘Magnificent Seven’ this earnings season,Investing
"These companies reporting earnings this week have a history of beating expectations, Bespoke says",Investing
How to get the biggest bang for your buck while investing in dividend-paying stocks,Investing
"This little-known genome editing stock is poised to surge more than 60%, JPMorgan says",Investing
This ETF tracking European stocks like LVMH gives U.S. traders access to a global comeback story,Investing
A lower-cost way to get long this ‘Magnificent 7’ member trading at an all-time high,Investing
Apple analysts are starting to get a bit worried ahead of earnings this week,Investing
Goldman Sachs says the soft landing for the economy is ‘on track’,Investing
"Monday’s analyst calls: Dollar store stock gets an upgrade, Citi sees big gains for this airline",Investing
Warren Buffett’s Berkshire Hathaway keeps buying Liberty’s SiriusXM tracking shares. Here’s why,Investing
"Wisconsin’s new legislative maps signed into law, setting up Dems to gain seats in November",Politics
‘China has a lot more to lose’: U.S. considering sanctioning Chinese firms aiding Russia’s war,Politics
Russia says an investigation is underway into Navalny’s death,Politics
Houthis claim ‘catastrophic’ attack in Red Sea as crew abandons ship,Politics
Trump breaks silence on Navalny; Yulia Navalnaya vows to fight on for a ‘free Russia’,Politics
Russia’s war in Ukraine is igniting an old debate in Brussels over debt,Politics
Biden administration to reportedly relax EV rule on tailpipe emissions,Politics
European leaders appeal for greater support for Ukraine as Russia makes major gain,Politics
China’s Wang Yi tells Blinken U.S. should lift sanctions on Chinese firms,Politics
"More than 400 detained in Russia at events in memory of Navalny, rights group says",Politics
"Trump will quit NATO, Hillary Clinton says, as anxiety mounts U.S. commitment",Politics
Germany’s defense minister says spending 2% on defense ‘can only be the start’,Politics
"Navalny death is a pre-election gambit from Putin, anti-Kremlin activist Bill Browder says",Politics
Jailed Putin foe Alexei Navalny confirmed dead with family calling for body,Politics
Zelenskyy ready to take Donald Trump to Ukraine’s front line,Politics
"Germany’s Scholz commits to spending 2% on defense ‘in the 2020s, in the 2030s and beyond’",Politics
Trump ordered to pay $454 million in fines and interest in NY fraud case,Politics
"Foremost Group CEO Angela Chao died after car went into Texas pond, sheriff says",Politics
U.S. troops will be the next to fight Russia without aid for Ukraine: Sen. Coons,Politics
World leaders react with horror to reports of Putin critic Navalny’s death,Politics
"Only the U.S. can force peace in the Middle East, Lebanon foreign minister says",Politics
"Jailed Putin opponent Alexei Navalny has died, Russian media says",Politics
A huge security conference is kicking off in Europe — here’s what to expect,Politics
"Opposition leader Navalny dies, Russian media says; Ukraine withdraws some troops from Avdiivka",Politics
Egypt setting up area at Gaza border which could be used to shelter Palestinians: Reuters,Politics
U.S. President Joe Biden again tells Netanyahu that Rafah civilians must be protected,Politics
DWAC shares soar as merger with Trump social media company appears closer,Politics
Trump DA Fani Willis takes the stand as judge considers whether to disqualify her,Politics
"Trump hush money trial to start March 25, judge says in denying dismissal bid",Politics
Russia’s Putin says he prefers ‘more predictable’ Biden over Trump in U.S. election,Politics
Russian missiles shot down as Kyiv comes under fire; Zelenskyy vows to ‘clear the Black Sea’,Politics
Interest on national debt could threaten U.S. economic stability: CBO director,Politics
Democrats see New York special election win as a blueprint for defeating Trump in November,Politics
NATO chief concedes ‘valid point’ of spending criticism as allies up defense budgets,Politics
Ukraine destroys Russian landing ship in Black Sea; NATO’s Stoltenberg says Kyiv aid ‘not charity’,Politics
House Republicans impeach Homeland Security Secretary Mayorkas,Politics
Former Ron DeSantis Wall Street fundraiser to bolster Trump’s campaign war chest,Politics
Bitcoin money launderer Ian Freeman ordered to pay $3.5 million to romance scam victims,Politics
Lael Brainard slams food companies for ‘shrinkflation’ as White House attacks price gouging,Politics
Supreme Court gives Trump prosecutor a week to respond to delay request in election case,Politics
"New York Democrat Tom Suozzi wins special House election, cuts slim GOP majority",Politics
Treasury proposes rule to extend anti-money laundering regs to investment advisers,Politics
European Union is considering sanctions on Chinese firms for aiding Russia’s war machine,Politics
"U.S. Senate approves Ukraine, Israel aid, but bill faces tough path through House",Politics
Ukraine says Russia buying Starlink terminals via Arab countries; Senate passes foreign aid bill,Politics
"China and Russia no longer perceived as top security threats, research finds",Politics
Criminal sentencing of Binance founder CZ postponed to late April,Politics
Trump asks Supreme Court to delay a presidential immunity ruling in 2020 election case,Politics
Senators demand Meta furnish details of Instagram’s ‘warning screens’ for child sexual abuse content,Politics
Trump Georgia election judge may force D.A. to testify in disqualification hearing,Politics
"Secretary Austin cancels Brussels trip for Ukraine, NATO meetings after hospitalization",Politics
Trump attends Florida hearing in special counsel classified documents case,Politics
5 things to know before the stock market opens Monday,Politics
Trump’s NATO comments stir up a political storm as Russia keeps quiet,Politics
Dutch court orders halt to export of F-35 jet parts to Israel,Politics
Israeli forces rescue 2 hostages in dramatic Gaza raid,Politics
Musk denies selling Starlink terminals to Russia after Kyiv alleges their use in occupied areas,Politics
U.S. advances Ukraine aid bill; Russia accused of using Musk’s Starlink in occupied territories,Politics
Angry farmer protests are spreading across Europe — and getting results,Politics
Russia’s Wagner Group expands into Africa’s Sahel with a new brand,Politics
"Biden campaign debuts official TikTok account, but app is still banned on most government devices",Politics
"Defense Secretary Lloyd Austin hospitalized for bladder issue, transfers duties to deputy",Politics
"Senate moves forward with Israel, Ukraine funding after vote on Super Bowl Sunday",Politics
Biden campaign co-chair fires back at speculation on the president’s mental capacity,Politics
Trump says he warned NATO ally: Spend more on defense or Russia can ‘do whatever the hell they want’,Politics
Hungarian president Novak resigns over sex abuse case pardon,Politics
Taiwan reports more Chinese balloons over Taiwan Strait,Politics
"Top House China hawk to retire, opening seat in battleground Wisconsin",Politics
Pakistan ex-PM Imran Khan aide says party aims to form government,Politics
"Palestinians brace for Rafah evacuation, Israeli assault plan",Politics
Trump’s pro-Anheuser-Busch post came after UFC boss Dana White urged him to back company: Source,Politics
Trader Joe’s appeals dismissal of lawsuit claiming labor union violated trademark,Politics
Pakistan’s ex-PM Nawaz Sharif declares victory in fraught election as opponents claim vote-rigging,Politics
Putin hints at swapping detained Wall Street Journal reporter for Russian prisoner,Politics
Ukraine’s Zelenskyy takes one of his ‘biggest gambles’ yet by replacing top military commander,Politics
Putin claims Russia has no interest in wider war; UAE mediates prisoner exchange,Politics
The top UN court has ruled on Gaza genocide case. Here’s what happens now,Politics
U.S. lawmakers accuse five major VC firms of investing billions in Chinese military-linked companies,Politics
"Donald Trump wins Nevada Republican caucus, NBC News projects",Politics
"Biden says ‘my memory is fine,’ disputes special counsel’s report in national address",Politics
Judge denies Peter Navarro’s bid to remain out of prison while appealing contempt of Congress case,Politics
Former Fox News host Tucker Carlson interviewed Russian President Vladimir Putin,Politics
"Trump media deal partner DWAC nears $50 million financing, sources tell Reuters",Politics
"Biden ‘willfully’ kept classified materials, had ‘poor memory’: Special counsel",Politics
"Senate advances $95 billion Ukraine, Israel funding bill, faces uphill battle as budget talks loom",Politics
Top Biden official at Senate hearing defends liquefied natural gas pause,Politics
AI-generated voices in robocalls can deceive voters. The FCC just made them illegal,Politics
"5 Marines aboard helicopter that went down outside San Diego are confirmed dead, military says",Politics
5 things to know before the stock market opens Thursday,Politics
Supreme Court skeptical of Trump ballot disqualification by Colorado,Politics
Tucker Carlson reportedly leaves Russia; Ukraine’s Zelenskyy appoints new army chief,Politics
‘Stability is fragile’: An overlooked European conflict zone is at a tipping point,Politics
"Chinese firm behind ‘news’ websites pushes pro-Beijing content globally, researchers find",Politics
Marianne Williamson drops long-shot 2024 presidential bid,Politics
Budget office: Biden green energy plan will cost much more than initial projections,Politics
Trump Media SPAC insider trading defendant hit with new money laundering count,Politics
"U.S. engineer contacted China before stealing missile tracking tech, DOJ says",Politics
EU tells Hungary its ‘sovereignty’ law violates EU law,Politics
Trump-admiring populist Milei lashes out at Argentina’s governors after major reform bill setback,Politics
5 things to know before the stock market opens Wednesday,Politics
China appoints ‘Broker Butcher’ Wu Qing as new chairman of securities regulator,Politics
"Netanyahu rejects ceasefire proposal, insists on total victory over Hamas",Politics
Dutch far-right leader Wilders’ hopes of becoming prime minister sink after coalition talks collapse,Politics
Tucker Carlson teases interview with Putin; Kremlin says ex-Fox News host is not ‘pro-Russian’,Politics
"‘None of these candidates’ defeats Nikki Haley in Nevada Republican primary, NBC News projects",Politics
"Biden wins Nevada Democratic primary, NBC News projects",Politics
"China expresses concerns to U.S. over tariffs, sanctions in Beijing talks",Politics
No criminal charges expected in Biden classified documents probe: NBC,Politics
Senate probe zeroes in on tax deductions billionaire Harlan Crow took on superyacht,Politics
"Elon Musk’s X funds Gina Carano lawsuit vs. Disney, Lucasfilm over ‘Mandalorian’ firing",Politics
"ESPN, Fox and Warner Bros. Discovery to launch joint sports streaming platform this year",Politics
Tucker Carlson set to interview Vladimir Putin,Politics
"House Republican vote to impeach Mayorkas fails, a major defeat for Johnson",Politics
Trump fraud trial judge demands details about possible perjury by Allen Weisselberg,Politics
Leon Cooperman says he will not vote for Trump or Biden,Politics
New Senate bill aims to kill proposed SEC rule on AI conflicts of interest,Politics
Appeals court denies Trump immunity in 2020 criminal election case,Politics
The prospect of a united Ireland emerges as a republican leader takes office in Belfast,Politics
Tucker Carlson says he’ll interview Putin; tensions rise at Russian-held nuclear plant,Politics
"U.S. Treasury team heads to China to talk subsidies, economic policies",Politics
"Bankrupt trucker Yellow repays $700 million Covid loan, Teamsters blast ‘failed executives’",Politics
"Nikki Haley requests Secret Service protection, citing rise in threats",Politics
Trump wants to debate Biden ‘immediately’ — but president shrugs him off,Politics
Kremlin declines to comment on Tucker Carlson rumors; Russian war critic’s election bid set to be rejected,Politics
Russia’s war in Ukraine has had an unlikely consequence — reviving EU plans to get even bigger,Politics
Australian writer Yang Hengjun given suspended death sentence in Beijing,Politics
"Senate releases $118 billion bipartisan aid proposal for Israel, Ukraine, border security",Politics
Trump floats ‘more than’ 60% tariffs on Chinese imports,Politics
"U.S. intends to take ‘additional strikes’ against Iran-backed groups, national security advisor says",Politics
Senators race to release their package of border policies and aid for Ukraine and Israel,Politics
"Biden nets landslide victory in South Carolina Democratic primary, over 95% of votes",Politics
Nikki Haley makes surprise ‘Saturday Night Live’ cameo asking ‘Trump’ questions,Politics
House Speaker Johnson announces ‘standalone’ Israel funding package,Politics
"U.S. launches retaliatory strikes in Iraq, Syria, nearly 40 reported killed",Politics
Judge postpones Trump D.C. election trial pending appeal,Politics
Court blocks Florida law barring Chinese citizens from owning property,Politics
Trump Georgia prosecutor admits romantic relationship with Atlanta D.A. boss,Politics
Three people indicted in $400 million FTX crypto hack conspiracy,Politics
Malaysia halves jail sentence of ex-prime minister Najib,Politics
World Court rules in favor of Kyiv on genocide case; Zelenskyy says EU aid sends ‘clear signal’ to Moscow and the U.S.,Politics
Russian war critic poses an awkward challenge for Putin and the Kremlin as the election nears,Politics
Trump clemency recipient Philip Esformes reaches plea deal in Medicare fraud case,Politics
Trump New York business fraud case verdict delayed to later in February,Politics
Ad giant Publicis paying $350 million to settle U.S. opioid crisis claims,Politics
Defense Secretary Lloyd Austin apologizes for his handling of cancer diagnosis and hospitalization,Politics
Donald Trump’s lawsuit over ‘Steele dossier’ thrown out by UK court,Politics
EU agrees $54 billion aid package for Kyiv; Orban says Hungary’s funds excluded from deal,Politics
"Biden, allied groups $140 million campaign war chest dwarfs Republican rivals",Politics
"Haley campaign started election year with $14 million, after raising $17 million last quarter",Politics
"Trump campaign raised $19 million in Q4, entering election year with $33 million cash",Politics
"Nikki Haley super PAC enters election year with just $3 million, adding to woes",Politics
Man pleads guilty in $1 billion scheme to dodge money laundering rules in New York,Politics
"John Podesta will take over for John Kerry as the U.S. special climate change envoy, AP source says",Politics
"QAnon-linked legal fund spent $400,000 defending Trump allies, new filing shows",Politics
Judge dismisses Disney’s lawsuit alleging retaliation by Florida Gov. Ron DeSantis,Politics
"Trump campaign chief urges GOP megadonors to ignore Trump’s words, focus on primary lead: Sources",Politics
FBI shuts down China’s ‘Volt Typhoon’ hackers targeting U.S. infrastructure,Politics
Meta chief Mark Zuckerberg ‘needs to do the right thing’ in child sex targeting fight: New Mexico AG,Politics
"Chinese hackers are determined to ‘wreak havoc’ on U.S. critical infrastructure, FBI director warns",Politics
Putin’s anti-war opponent takes step toward election; Russia says West could meddle in upcoming vote,Politics
"Pakistan ex-PM Imran Khan hit with new 14-year jail sentence, a day after receiving 10-year term",Politics
"U.S.-China fentanyl talks get off to a ‘productive’ start, security advisor says",Politics
"Highlights of Tesla CEO Elon Musk’s court ruling: Mars, Frankenstein, a self-driving car pun",Politics
Trump allies ramp up attacks on Taylor Swift ahead of Super Bowl,Politics
Walmart announces 3-for-1 stock split as shares hover below all-time high,Politics
"Elon Musk’s $56 billion Tesla compensation voided by judge, shares slide",Politics
Citadel CEO and billionaire Ken Griffin donated $5 million to Nikki Haley super PAC,Politics
Russian oligarch Dmitry Rybolovlev loses suit accusing Sotheby’s of art fraud,Politics
White House touts highest consumer confidence in more than 2 years,Politics
E. Jean Carroll lawyer says Trump claims of judge conflict no basis to toss $83.3 million verdict,Politics
"Fahmi Quadir, short seller nicknamed ‘The Assassin,’ takes aim at for-profit college giant Adtalem",Politics
Former Pakistan Prime Minister Imran Khan sentenced to 10-year jail term,Politics
"Absurd to believe Russia will invade other countries, Moscow says; Kyiv says it has destroyed Su-34 jet",Politics
DOJ and SEC unveil charges in $1.9 billion HyperFund cryptocurrency fraud,Politics
Trump attempts to take credit for stock market record highs under Biden,Politics
"Sen. Elizabeth Warren pushes Fed Chair Powell to cut ‘astronomical’ rates, ease housing pressure",Politics
Haley hits Trump on tariffs ahead of her Wall Street fundraisers,Politics
Trump lashes out at financial monitor in business fraud case after she reports errors,Politics
Hungary accuses EU of blackmail over Ukraine aid standoff,Politics
White House announces new federal investments in Regional Innovation Engines,Politics
Biden faces demands from Republicans in Congress to strike Iran after U.S. troop deaths,Politics
5 things to know before the stock market opens Monday,Politics
"Zelenskyy’s income fell drastically following Russia’s invasion, new declaration reveals",Politics
Zelenskyy publishes income as part of EU push; Hungarian foreign minister arrives in Ukraine,Politics
Nikki Haley slams Trump for trying to torpedo congressional border deal,Politics
House GOP releases impeachment articles in bid to oust Homeland Security’s Mayorkas over the border,Politics
Trafigura assesses Red Sea risks after tanker attacked by Houthis,Politics
U.S. reviewing Venezuelan sanctions policy in wake of court decision,Politics
"Russia’s drones, missiles target Ukraine’s critical infrastructure, Kyiv says",Politics
"Guterres: UN to punish staffers involved in ‘terror,’ urges UNRWA funding",Politics
Beijing intensifies military pressure on Taiwan as U.S.-China talks resume,Politics
Republican presidential candidate Nikki Haley targeted in swatting incident,Politics
"WWE founder Vince McMahon resigns from TKO Group after being accused of sexual assault, trafficking",Politics
FTC fines Kubota $2 million in largest ever ‘Made in the USA’ penalty,Politics
"Former New York Gov. Andrew Cuomo sexually harassed at least 13 women, DOJ says",Politics
Jury rules Trump must pay E. Jean Carroll $83.3 million in damages for defamation,Politics
Saudi Arabia’s first alcohol store aims to tackle a longstanding problem: Booze smuggling,Politics
Nikki Haley touts $1.2 million in donations after Trump vows to blacklist her donors,Politics
Alabama execution using nitrogen gas puts U.S. at front of death penalty debate,Politics
"Top UN court rules Israel must prevent genocide in Gaza, falls short of ordering a cease-fire",Politics
"Xpeng plans to hire 4,000 people, invest in AI as CEO warns EV rivalry may end in ‘bloodbath’",Technology
Nintendo shares fall nearly 6% after report that the Switch 2 will be delayed,Technology
Singapore’s AI ambitions get a boost with $740 million investment plan,Technology
EU reportedly set to fine Apple 500 million euros amid antitrust crackdown,Technology
Sony plunged $10 billion after its PS5 sales cut. But a bigger issue is its near decade low games margin,Technology
What the U.S. can learn from Norway when it comes to EV adoption,Technology
