Header,Section
Karuna Therapeutics surges 47% after Bristol Myers Squibb announces $14 billion deal,Health_and_Science
Here are the big health sector themes to watch next year,Health_and_Science
Asia’s year in review: Who had it good — and who had it bad — in 2023,Health_and_Science
CDC director says U.S. isn’t yet near peak Covid or flu levels for the season,Health_and_Science
"Singapore’s latest Covid spike may be peaking, but don’t stop vaccinating, health minister says",Health_and_Science
"Weight loss drugs, Alzheimer’s treatments and gene editing: Enormous firsts defined 2023 in pharma",Health_and_Science
"SEC charges ex-CEO of medical device company with fraud, says some devices ‘just a piece of plastic’",Health_and_Science
"Our rapid-fire update on all 33 stocks in the portfolio, including ones Cramer would buy on dips",Health_and_Science
The weight loss drug boom isn’t over yet — here’s what to expect in the year ahead,Health_and_Science
"Prescriptions for Eli Lilly’s new weight-loss drug get off to a strong start, confirm bright outlook",Health_and_Science
"Coca-Cola recalled 2,000 cases of drinks due to potential contamination",Health_and_Science
"Moderna, Merck vaccine with Keytruda cuts risk of deadly skin cancer returning in half, data says",Health_and_Science
"If you can’t build the next Ozempic, buy it: Where M&A could be heading in the obesity drug space",Health_and_Science
Vertex shares pop after nonopioid painkiller posts positive midstage trial results,Health_and_Science
Supreme Court agrees to hear showdown over abortion pill access,Health_and_Science
Google is rolling out new AI models for health care. Here’s how doctors are using them,Health_and_Science
"Weight gain after stopping Eli Lilly’s new obesity treatment should help, not hurt the stock",Health_and_Science
"Patients regain weight after stopping Eli Lilly’s Zepbound, study says",Health_and_Science
Flying solo without Cigna will keep Humana focused on 2 big priorities in the year ahead,Health_and_Science
"Cigna shares jump on reports of abandoned Humana buyout, plans for $10 billion stock buyback",Health_and_Science
Criminals make millions by counterfeiting drugs – here’s how Big Pharma fights it,Health_and_Science
"U.S. approves first gene-editing treatment, Casgevy, for sickle cell disease",Health_and_Science
U.S. poised to approve first gene-editing treatment in breakthrough for sickle cell patients,Health_and_Science
Biden administration asserts power to seize drug patents in move to slash high prices,Health_and_Science
Biden administration delays ban on menthol cigarettes until 2024,Health_and_Science
AbbVie to acquire neuroscience drugmaker Cerevel Therapeutics for $8.7 billion,Health_and_Science
Senators launch bipartisan probe of private equity’s growing role in U.S. health care,Health_and_Science
Eli Lilly weight loss drug Zepbound now available at pharmacies as rival Wegovy faces shortages,Health_and_Science
CVS to change how it prices prescription drugs with new pharmacy reimbursement model,Health_and_Science
Reproductive startup launches test to identify embryo’s genetic defects before IVF pregnancy begins,Health_and_Science
"Free ChatGPT may incorrectly answer drug questions, study says",Health_and_Science
"L.A. poultry firm hired kids as young as 14 to work with sharp knives, Labor Dept. says",Health_and_Science
Roche targets obesity pill with Carmot Therapeutics takeover,Health_and_Science
Pfizer’s twice-daily weight loss pill joins a long list of obesity drug flops,Health_and_Science
Why Pfizer’s latest stumble in the obesity market is a boon for Eli Lilly,Health_and_Science
Pfizer to discontinue twice-daily weight loss pill due to high rates of adverse side effects,Health_and_Science
"Novo Nordisk sues two pharmacies for allegedly selling tainted Wegovy, Ozempic knockoffs",Health_and_Science
Biotech stocks jump on AbbVie deal to buy cancer drugmaker ImmunoGen for $10 billion,Health_and_Science
Jim Cramer blasts the prospect of a Humana-Cigna deal — it could never be approved by regulators,Health_and_Science
Nashville’s startup scene is booming as health-tech investors and founders flock to the Music City,Health_and_Science
Covid vaccine rates in the U.S. are slumping — and it will be a challenge to boost them,Health_and_Science
"Cigna, Humana shares fall after report health-care giants are in talks to merge",Health_and_Science
Citi is so bullish on this biotech stock it gives it 800% potential upside,Health_and_Science
Jim Cramer knocks down a new analyst sell rating on a medtech stock as shortsighted,Health_and_Science
"Mounjaro is more effective than Ozempic for weight loss, real-world study says",Health_and_Science
Why the American Red Cross makes money from donated blood,Health_and_Science
China reports no ‘unusual or novel pathogens’ after WHO seeks data on respiratory illness outbreak,Health_and_Science
Can you hack your brain? These companies are driving innovation in the field of brain stimulation,Health_and_Science
U.S. to offer another round of free at-home Covid tests starting Monday,Health_and_Science
‘The silent pandemic’: A hotter world makes it harder to stop the spread of deadly superbugs,Health_and_Science
"Rosalynn Carter, former first lady and tireless humanitarian who advocated for mental health issues, dies at 96",Health_and_Science
"CDC expedites release of more doses of infant RSV drug from Sanofi, AstraZeneca amid shortage",Health_and_Science
Here’s what Wall Street is saying about obesity drug Wegovy following Novo Nordisk’s key study,Health_and_Science
Pfizer wants in on the weight loss drug market – and upcoming data will be crucial for its success,Health_and_Science
Amputees say this bionic hand startup gives them both strength and grace,Health_and_Science
Novo Nordisk’s weight loss drug Wegovy slashes risk of serious heart events,Health_and_Science
"Lilly trades at a premium to Ozempic maker Novo as obesity drugs boom. Here’s why, analyst says",Health_and_Science
"Patients are lining up for $2,500 full-body MRI scans that can detect cancer early",Health_and_Science
Amazon adds a new reason to get and keep Prime: member discounts on health-care services,Health_and_Science
"FDA approves Eli Lilly’s tirzepatide for weight loss, paving way for wider use of blockbuster drug",Health_and_Science
"Pharmacy walkout organizers help launch national push to unionize pharmacists, technicians",Health_and_Science
Health AI startup Cercle debuts with backing from Sheryl Sandberg,Health_and_Science
Ohio voters enshrine abortion rights in state constitution,Health_and_Science
"These are the stocks that will benefit — and lose out — from the wellness trend, Morgan Stanley says",Health_and_Science
Planet Fitness shares surge as company raises revenue outlook,Health_and_Science
Wall Street asks how weight loss drugs will affect consumer giants — but it may be too soon to tell,Health_and_Science
"The Ozempic effect has battered this weight loss stock, but Morgan Stanley says it’s a top pick",Health_and_Science
"High school kids are vaping less, FDA and CDC say",Health_and_Science
Novo Nordisk says 80% of insured U.S. patients taking Wegovy pay less than $25 a month,Health_and_Science
Eli Lilly says supply of blockbuster diabetes drug Mounjaro has improved in U.S.,Health_and_Science
Eli Lilly results top estimates on Mounjaro strength but slashes full-year profit outlook,Health_and_Science
Moderna stock falls as sinking Covid vaccine demand drives steep loss,Health_and_Science
The sell-off in Humana is overdone after strong earnings. Jim Cramer says buy the stock,Health_and_Science
New lung cancer screening guidelines expand who should get tested annually,Health_and_Science
Doctors have a new way to scrub personal information from internet after spike in harassment,Health_and_Science
"CVS results top expectations, lifted by strong health services revenue",Health_and_Science
"Pfizer swings to quarterly loss due to Paxlovid, Covid vaccine write-offs",Health_and_Science
"Some pharmacy staff from Walgreens, other chains are walking out again — what you need to know",Health_and_Science
Here are 5 anti-obesity drug stocks besides Novo Nordisk and Eli Lilly to watch into year-end,Health_and_Science
We had a busy week of trades in an oversold market. Here’s the day-by-day breakdown,Health_and_Science
"Pharmacy staff from Walgreens, CVS say they’re at a breaking point — here’s what their days look like",Health_and_Science
"Pfizer’s combination Covid, flu vaccine will move to final-stage trial after positive data",Health_and_Science
Bristol Myers Squibb earnings top estimates even as top-selling drug fights generic competition,Health_and_Science
"Merck results beat expectations on strong Keytruda sales, surprise Covid drug growth",Health_and_Science
More convenient form of breakthrough Alzheimer’s drug Leqembi shows promising results in study,Health_and_Science
RSV vaccine from GSK shows potential to protect adults 50 to 59,Health_and_Science
Picking health insurance can be tricky: 6 key terms to know as open enrollment starts,Health_and_Science
We’re buying more of this life sciences stock after an earnings-driven decline,Health_and_Science
Amazon considers offering veterinary telehealth as it looks to compete with Walmart,Health_and_Science
"As Ozempic and Wegovy take off, this startup just raised $20 million to tackle weight loss with data",Health_and_Science
Wall Street hikes forecasts for anti-obesity drug sales to $100 billion and beyond,Health_and_Science
These stocks are trying to solve a major shortcoming of weight loss drugs: Shrinking muscle mass,Health_and_Science
Supreme Court blocks restrictions on Biden administration efforts to remove contentious social media posts,Health_and_Science
CVS to pull certain cold medicines containing decongestant phenylephrine from store shelves,Health_and_Science
Sanofi to offer insulin product for $35 to all Americans through GoodRx,Health_and_Science
"Pfizer to price Covid drug Paxlovid at $1,390 per course",Health_and_Science
Amazon begins delivering medications by drone in Texas,Health_and_Science
FDA proposes ban on hair relaxers with formaldehyde,Health_and_Science
"Johnson & Johnson beats on earnings and hikes outlook as medtech, pharmaceutical sales surge",Health_and_Science
"Pfizer gets upgrade at Jefferies, which says there’s a buying opportunity in the pharma giant",Health_and_Science
"UBS upgrades this ‘core’ health-care stock, sees nearly 20% upside",Health_and_Science
"Rite Aid files for bankruptcy amid slowing sales, opioid litigation",Health_and_Science
When is it OK to violate your cost basis to buy more shares of a company?,Health_and_Science
Many are betting Ozempic will reduce the need for knee surgery. What it means if they’re wrong,Health_and_Science
"Pfizer slashes full-year earnings and revenue guidance as Covid treatment, vaccine sales slump",Health_and_Science
Biden praises Kaiser Permanente labor agreement after worker strike: ‘Collective bargaining works’,Health_and_Science
"Pharmacy staff from Walgreens, other chains could stage nationwide walkout",Health_and_Science
The U.S. has high maternal mortality rates — and it has gotten worse for Latinas,Health_and_Science
"New RSV protections for infants hit cost, insurance hurdles in U.S. rollout",Health_and_Science
"Novo Nordisk hikes outlook on soaring demand for Wegovy, Ozempic",Health_and_Science
"UnitedHealth is back and lifting other health-care stocks with it, Jim Cramer says",Health_and_Science
Here are 3 stocks in our portfolio that Goldman Sachs think will rally on earnings,Health_and_Science
Incoming Walgreens CEO doesn’t mention walkouts as he praises pharmacy staff,Health_and_Science
"Walgreens stock rises as cost cuts make progress, even as profit outlook comes up short",Health_and_Science
‘Waiting with bated breath’: Health clinics anxious for Covid vaccines weeks after rollout,Health_and_Science
Monthly Meeting Q&A with Jim Cramer on everything from tech to health care to industrials,Health_and_Science
"Here’s a rapid-fire update on all 36 stocks in our portfolio, including our latest addition",Health_and_Science
"Jim Cramer praises Walgreens new CEO pick, says buy the stock ‘perhaps aggressively’",Health_and_Science
"Period care brands August, Rael and others fight the ‘tampon tax,’ reimburse consumers",Health_and_Science
Walgreens names veteran health-care executive Tim Wentworth as next CEO,Health_and_Science
15 stocks with a history of dividend growth are expected to deliver once again this year,Health_and_Science
"As Covid-testing business drops, Abbott searches for new line of business with consumer wearables",Health_and_Science
Microsoft announces new AI tools to help doctors deliver better care,Health_and_Science
This animal health stock could gain nearly 30% as it ramps up sales of dog arthritis treatment,Health_and_Science
How Ozempic and Wegovy turned Novo Nordisk into a $400 billion company,Health_and_Science
Top Wall Street analysts like these 3 stocks for long-term growth,Investing
"These options plays can help investors profit from a pullback in stocks, Goldman says",Investing
Goldman Sachs likes these five tech stocks coming out of earnings,Investing
Cocoa hit a record high. Here’s what’s driving the gains,Investing
"These are the stocks investors should bet against, Wolfe Research says",Investing
Carl Icahn gets two seats on JetBlue’s board. Here’s how he may help build value,Investing
"Nvidia earnings, Fed minutes on deck next week as Wall Street assesses interest rate outlook",Investing
Learn how Singapore Airlines goes above and beyond to deliver a memorable travel experience,Investing
This little-known bank is offering one of the highest CD rates,Investing
How the ‘Magnificent Seven’ stacks up with the great bubbles of all time,Investing
"Pharma, ride-share providers among most overbought S&P 500 stocks this week",Investing
Morgan Stanley says Eli Lilly could become the first $1 trillion pharma stock,Investing
Wall Street cheers Coinbase after its first quarterly profit in 2 years,Investing
A short-term options trade that wins if Nvidia’s earnings can’t live up to the hype,Investing
"Nvidia gets a $1,200 price target from Loop Capital, 65% above current price",Investing
"Friday’s top analyst calls: Nvidia, Nike, Tesla, Coinbase, Arm, Meta, Eli Lilly",Investing
Cooperman says investors are too optimistic. Where he bought and sold in Q4,Investing
"Friday’s analyst calls: Street-high Nvidia price target, Nike gets a downgrade",Investing
Move over Nvidia. A new hot AI play that has soared 950% in the past year,Investing
This type of ETF offers income and complexity. Find out if it’s right for you,Investing
"Jeffrey Smith sticks with activist bet on GoDaddy, trims Salesforce stake",Investing
Traders should be worried if they’re holding this Magnificent 7 member,Investing
Tax refund season could boost these stocks favored by small investors,Investing
What’s behind the ‘once-in-a decade momentum’ in Arm Holdings stock,Investing
Halvorsen’s Viking Global bought this regional bank in the fourth quarter,Investing
Picking the right covered call strategy to generate income on the stocks you own,Investing
"Stanley Druckenmiller exits Alphabet, keeps winning AI plays Nvidia, Microsoft",Investing
These stocks deliver earnings growth and have a track record of strong returns,Investing
"Thursday’s top analyst calls: Apple, Nvidia, Coinbase, Tesla, Berkshire Hathaway",Investing
"Analyst calls: Nvidia gets a target hike, health care stock primed for big gains",Investing
"Third Point’s Dan Loeb exits Alphabet, trims bets on Amazon and Microsoft",Investing
Tepper’s Appaloosa cut back semiconductor stocks while buying one well-known ETF,Investing
"Berkshire again keeps new stock purchase secret, trims giant Apple stake",Investing
Here’s what you should know about adding emerging markets bond exposure,Investing
Phillippe Laffont’s Coatue shifted money in technology amid fourth quarter rally,Investing
"Higher rates raising ‘downside risks’ for regional banks, warns Bank of America",Investing
"Michael Burry of ‘The Big Short’ fame buys Amazon, Alphabet and a dozen other new stocks",Investing
These 2 under-the-radar stocks are outperforming during the sell-off and ready to breakout,Investing
"Sundheim’s D1 hedge fund shook up its tech exposure, including selling the hottest stock right now",Investing
Evercore ISI says sell these two retail giants ahead of earnings on the shaky consumer,Investing
Dan Niles is long 4 and short 3 of the Magnificent 7 stocks,Investing
A bet using options that a long-underperforming bank is finally turning the corner,Investing
These oil companies could be the next takeover targets in Permian Basin after Diamondback deal,Investing
Baupost’s Seth Klarman dumps Coinbase and other stocks in the fourth quarter,Investing
"Here are Wednesday’s biggest analyst calls: Tesla, Nvidia, Arm, Citi, Walmart, First Solar, Ulta",Investing
AI is changing the cybersecurity industry. Why these two stocks look best positioned to capitalize,Investing
"Wednesday’s analyst calls: Big gains ahead for solar stock, Palantir gets downgraded",Investing
DoubleLine’s Jeff Gundlach warns that stocks are as ‘overvalued’ as early 2022,Investing
"Here’s what bitcoin’s chart says about its next moves after it breached $50,000 this week",Investing
The charts show the S&P 500 is at a very critical juncture. How to protect your portfolio,Investing
High yields on savings are coming down. Here’s where you can still get 5% on cash,Investing
These are the stocks hedge funds are betting the most against with S&P 500 at this lofty level,Investing
Playing the sell-off: A bearish trade on an over-extended Nasdaq stock,Investing
Expecting more sell-offs? These low-volatility fortresses can defend your portfolio and grow,Investing
"Long cash, short tech: The ultimate contrarian trades as investors turn the most bullish in 2 years",Investing
Bank of America says try the ‘Magnificent 80’ portfolio as income investing comes back into favor,Investing
"Here are Tuesday’s biggest analyst calls: Nvidia, Disney, Walmart, Apple, Arista, Ford, Rivian",Investing
"Tuesday’s analyst calls: Big Nvidia price target increase, pharma giant gets an upgrade",Investing
This Morningstar 5-star rated high-yield fund seeks to ‘stand out by not fitting in’,Investing
Look out above and below. These stocks are expected to see the biggest moves this week,Investing
"This construction ETF is breaking out with no sell signals on the horizon, according to the charts",Investing
"Shares of UFC and WWE parent company are primed to rally 40%, Jefferies says",Investing
Goldman says these types of dividend stocks are the best to own in wake of big Meta payout news,Investing
A trade on this casino stock before earnings that uses options to increase the probability of profit,Investing
"How to make money investing in software stocks, according to Trivariate Research",Investing
"BTIG: This is the hottest trade going on in the market right now, but it’s reaching a breaking point",Investing
"Here are Monday’s biggest analyst calls: Netflix, Nvidia, Apple, Meta, Lowe’s, Walmart, Target",Investing
"Monday’s analyst calls: Rivian downgrade, JPMorgan sees strong gains for Lowe’s",Investing
"Bitcoin, AI and Magnificent 7: The emerging ETF trends as industry gathers for big conference",Investing
Chinese stocks are trying to rebound. This is the trade to watch to know if the turnaround is for real,Investing
Top Wall Street analysts pick these 3 dividend stocks for the long haul,Investing
"Berkshire Hathaway topped $600,000 a share last week, aiming at $1 trillion market value",Investing
"These cheap turnaround candidates have 20% upside potential, says Jefferies",Investing
This India ETF is beating its main rivals — and the S&P 500 — in 2024,Investing
"These stocks have upside heading into earnings ahead, Bank of America says",Investing
"Ether is poised for an ETF approval in May, but the crypto’s price action may be subdued",Investing
Activist Ancora may turn to a reliable tactic to enhance value at Norfolk Southern,Investing
Fluence CEO says energy storage leader has record backlog that will push it to profitability this year,Investing
New York Community Bancorp insiders step in to buy falling shares of the regional bank,Investing
"S&P 500 could rise to 5,300 after hitting latest milestone, says UBS wealth head",Investing
Vanguard launches two new ETFs to hit this sweet spot of tax-free fixed income,Investing
These stocks about to report earnings typically beat expectations and gain,Investing
"Taylor Swift will lead to more Super Bowl betting, especially at one sportsbook, analyst says",Investing
"A lower cost way to ride the S&P 500 if it keeps rallying to 5,100",Investing
Here are stocks reporting earnings next week that have the wind at their back,Investing
"These stocks, including Lululemon, are breaking down even as the S&P tops 5,000",Investing
Gauging the risk of contagion from NYCB and commercial real estate woes,Investing
CNBC Pro Talks: How to protect your portfolio amid rising geopolitical risks,Investing
PayPal shares plummet; one analyst likens CEO’s strategy to ‘turning around the titanic’,Investing
Short sellers increasing their bets against regional banks amid NYCB’s woes,Investing
"S&P 500′s run to 5,000 masking some serious issues lurking beneath, according to the charts",Investing
"High-yield bonds will be one of the top performers this year, according to State Street. Here’s why",Investing
"A lower-cost way to play the S&P 500′s run to 5,000",Investing
India is the new Asia growth story. Here’s why investors are bullish on the outlook,Investing
JPMorgan says oil could rise to the high $80s by May,Investing
"Thursday analyst calls: Disney draws praise for earnings, AmEx, Alibaba get downgrades",Investing
Fewer stocks are participating in this rally. History shows that bodes ill for future returns,Investing
"Cathie Wood is standing by Tesla amid sharp sell-off, betting on robotaxi cycle in 2 years",Investing
Investors can’t get enough of tech stocks even as they dominate the S&P 500,Investing
Goldman warns these are the most crowded AI-related stocks,Investing
Hedge fund billionaire Bill Ackman to launch a NYSE-listed fund for regular investors,Investing
"This volatile ETF not for the faint-hearted might be breaking out, according to the charts",Investing
Here’s what major analysts are chattering about before Disney earnings,Investing
Morgan Stanley hikes Nvidia price target ahead of earnings: ‘AI demand continues to surge’,Investing
Karen Firestone: Here’s what’s fueling mega-cap tech’s win streak into 2024,Investing
Scooping up a cheap defense stock trading near a 52-week low while reducing the risk using options,Investing
"These stocks could be the hardest hit if Treasury yields don’t come down, says Piper Sandler",Investing
"Stocks making the biggest moves before the bell: Snap, Uber, Chipotle, Alibaba and more",Investing
"Wednesday analyst calls: JPMorgan cuts NYCB, Eli Lilly gets big boost, Chipotle named as possible Mag 7 member",Investing
Three stocks that could replace Tesla in the ‘Magnificent 7’,Investing
NYU’s ‘Dean of Valuation’ says Nvidia is ‘particularly overpriced’ after its surge this year,Investing
"Electricity demand from data centers, AI and crypto could double in 2 years. How to play it",Investing
Elanco’s $1.3 billion deal may give the company more flexibility as product launches ramp up,Investing
"Here’s who could be next to pay a dividend after Meta’s big announcement, according to Goldman",Investing
Seaport Research says a correction is here: ‘The market is too narrow and policy is too tight’,Investing
CleanSpark jumps on plans to buy four bitcoin mining facilities ahead of the halving,Investing
"Wait for a pullback to buy this rallying streaming play, according to the charts",Investing
"These stocks could be next to join the S&P 500, increasing demand for shares, says Bank of America",Investing
"These stocks could see sharp gains after analysts lifted 2024 earnings estimates, Jefferies says",Investing
Missed the Nvidia gravy train? Here’s an AI catch-up trade,Investing
"China auto stock to rebound 45% amid market rout, Deutsche Bank says",Investing
Tesla downgraded on concern Musk and board distractions could hurt innovation,Investing
"Here are Tuesday’s biggest analyst calls: Apple, Tesla, UPS, Disney, UBS, Broadcom, Tyson and more",Investing
"Tuesday’s analyst calls: McDonald’s gets a downgrade, UBS sees 25% upside for delivery giant",Investing
These are JPMorgan’s top stocks for February,Investing
Buckle up: These stocks are expected to have the wildest moves this week,Investing
"Retirees are about to shift money into equity income, boosting these stocks, says Bank of America",Investing
"Shares of this restaurant chain are forming a long-term turnaround, according to the charts",Investing
Bank of America traders are long Spotify because of new Taylor Swift album dropping in April,Investing
Goldman Sachs believes it’s likely the ‘Magnificent 7’ beats the market again this year,Investing
"Paramount, even with a takeover offer, may still prove a rare losing bet for Berkshire Hathaway",Investing
A bullish options bet on a rallying fintech into earnings,Investing
